{
  "attest_version": "1.0",
  "task_id": "ts-undeclared",
  "result": "fail",
  "exit_code": 1,
  "claims": [
    { "id": "c1", "status": "verified" },
    { "id": "c2", "status": "verified" }
  ],
  "undeclared_changes": [
    {
      "path": "src/auth.ts",
      "op": "modify",
      "granularity": "symbol",
      "severity": "flag",
      "symbol": "refreshToken",
      "symbol_kind": "function"
    },
    { "path": "src/format.ts", "op": "modify", "granularity": "file", "severity": "flag" }
  ],
  "summary": { "claims_total": 2, "verified": 2, "failed": 0, "unverifiable": 0, "undeclared": 2 }
}
