{
  "attest_version": "1.0",
  "task_id": "ts-partial",
  "result": "fail",
  "exit_code": 1,
  "claims": [
    { "id": "c1", "status": "verified" },
    { "id": "c2", "status": "verified" },
    { "id": "c3", "status": "failed", "reason": "no change detected for tests/auth.test.ts" }
  ],
  "undeclared_changes": [],
  "summary": { "claims_total": 3, "verified": 2, "failed": 1, "unverifiable": 0, "undeclared": 0 }
}
