{
  "attest_version": "1.0",
  "task_id": "py-lying",
  "result": "fail",
  "exit_code": 1,
  "claims": [
    { "id": "c1", "status": "verified" },
    { "id": "c2", "status": "verified" },
    {
      "id": "c3",
      "status": "failed",
      "reason": "symbol 'divide' (function) was not added in src/calc.py"
    }
  ],
  "undeclared_changes": [],
  "summary": { "claims_total": 3, "verified": 2, "failed": 1, "unverifiable": 0, "undeclared": 0 }
}
